beer,brewery,style,status
Alley Kat Olde Deuteronomy Barley Wine,Alley Kat Brewing Company,Barley Wine / Wheat Wine / Rye Wine,winter seasonal
Half Pints Burlywine,Half Pints Brewing Co.,Barley Wine / Wheat Wine / Rye Wine,winter seasonal
Half Pints Humulus Ludicrous,Half Pints Brewing Co.,IIPA DIPA - Imperial / Double IPA,special seasonal
Half Pints Little Scrapper IPA,Half Pints Brewing Co.,IPA,regular
Half Pints Stir Stick Stout,Half Pints Brewing Co.,Stout - Flavored / Pastry,regular
Big Rock Grasshopper Kristallweizen,Big Rock Brewery,Wheat Ale,regular
Big Rock Traditional Ale,Big Rock Brewery,Brown Ale,regular
Wild Rose IPA,Wild Rose Brewery (Sleeman - Sapporo),IPA,regular
Alley Kat Full Moon Pale Ale,Alley Kat Brewing Company,Pale Ale - American (APA),regular
Paddock Wood 606 India Pale Ale,Paddock Wood Brewing Co.,IPA,special seasonal
Paddock Wood Barrel Full of Monkeys Imperial Stout,Paddock Wood Brewing Co.,Stout - Imperial,special seasonal
Fort Garry Kona Imperial Stout,Fort Garry Brewing,Stout - Imperial Flavored / Pastry,series seasonal
Paddock Wood London Porter,Paddock Wood Brewing Co.,Porter,special seasonal
Half Pints Pothole Porter,Half Pints Brewing Co.,Porter - Baltic,spring seasonal
Blindman New England-Style Pale Ale,Blindman Brewing,Pale Ale - Hazy / New England,special seasonal
Half Pints Old Red Barn,Half Pints Brewing Co.,Sour Flemish Ale - Flanders Red / Oud Bruin,regular
Alley Kat Long Valley Scotch Ale,Alley Kat Brewing Company,Scotch Ale / Wee Heavy,special seasonal
Blindman Longshadows IPA,Blindman Brewing,IPA,regular
Paddock Wood Bête Noire Oatmeal Stout,Paddock Wood Brewing Co.,Stout - Oatmeal,regular
Blindman Triphammer Robust Porter,Blindman Brewing,Porter,regular
Blindman Ichorous Imperial Stout,Blindman Brewing,Stout - Imperial,winter seasonal
Village Blacksmith Black IPA,Village Brewery (Canada),IPA - Black / Brown / Cascadian Dark,regular
Apex White Raven IPA,Apex Brewing,IPA,regular
Brewsters Blue Monk Barley Wine,Brewsters Brewing Company & Restaurant,Barley Wine / Wheat Wine / Rye Wine,winter seasonal
Paddock Wood Sherbrooke Heartstopper Hot Chocolate Stout,Paddock Wood Brewing Co.,Stout,special seasonal
Half Pints Bulldog Amber Ale,Half Pints Brewing Co.,Red Ale / International Amber Ale,regular
Half Pints St. James Pale Ale,Half Pints Brewing Co.,Kölsch / Kölsch-Style,regular
Grizzly Paw Rutting Elk Red,The Grizzly Paw Brewing Company,Scottish Ale,regular
Klingon Warnog Roggen Dunkel,Federation of Beer,Specialty Grain - Rye / Roggenbier,regular
Black Bridge Milk Stout,Black Bridge Brewery (Canada),Stout - Milk / Sweet,regular
Fort Garry Dark Ale,Fort Garry Brewing,Mild Ale,regular
Fort Garry Portage and Main IPA,Fort Garry Brewing,IPA,regular
Paddock Wood Sherbrooke Ragutiene Baltic Porter,Paddock Wood Brewing Co.,Porter - Baltic,special seasonal
Paddock Wood Loki DIPA,Paddock Wood Brewing Co.,IIPA DIPA - Imperial / Double IPA,special seasonal
Paddock Wood Cherry Barrel Full of Monkeys,Paddock Wood Brewing Co.,Stout - Imperial,special seasonal
Wild Rose Barley Wine,Wild Rose Brewery (Sleeman - Sapporo),Barley Wine / Wheat Wine / Rye Wine,special seasonal
Torque Diesel Fitter Stout,Torque Brewing,Stout,regular
Big Rock Warthog English Style Mild Ale,Big Rock Brewery,Brown Ale,regular
Star Trek Klingon Imperial Porter,Federation of Beer,Porter - Imperial,special seasonal
Alley Kat Pumpkin Pie Spiced Ale,Alley Kat Brewing Company,Flavored - Other,autumn seasonal
Big Rock Citradelic,Big Rock Brewery,IPA,regular
Ribstone Creek Great White Combine IPA,Ribstone Creek Brewery,IPA - White,spring seasonal
Alley Kat St Portersburg Baltic Porter,Alley Kat Brewing Company,Porter - Baltic,regular
Blindman Imperial Stout - Basil Hayden Bourbon Barrel-Aged ,Blindman Brewing,Stout - Imperial,regular
Big Rock Scottish Style Heavy Ale,Big Rock Brewery,Scotch Ale / Wee Heavy,regular
Farmery Premium Lager,Farmery Estate Brewery,Pale Lager - International / Premium,regular
Bushwakker Palliser Porter,Bushwakker Brewing Co.,Porter,regular
Alley Kat Sherbrooke Glenda Sherbrooke,Alley Kat Brewing Company,Barley Wine / Wheat Wine / Rye Wine,special seasonal
Half Pints Phils Pils,Half Pints Brewing Co.,Pilsener / Pils / Pilsner,regular
Paddock Wood Sherbrooke Silenus Belgian Style Tripel,Paddock Wood Brewing Co.,Tripel,regular
Grizzly Paw Evolution IPA,The Grizzly Paw Brewing Company,IPA,winter seasonal
Black Bridge IPA!,Black Bridge Brewery (Canada),IPA,regular
Tool Shed Star Cheek IPA,Tool Shed Brewing Company,IPA,regular
Troubled Monk Pesky Pig Pale Ale,Troubled Monk,Pale Ale - American (APA),regular
Grizzly Paw Big Head Nutbrown,The Grizzly Paw Brewing Company,Brown Ale,regular
Last Best IPA,Last Best Brewing & Distilling (Bear Hill Brewing),IPA,regular
Situation Page Turner IPA,Situation Brewing,IPA,regular
Paddock Wood Xocolatl Porter Chocolate ,Paddock Wood Brewing Co.,Porter,special seasonal
Outcast Neon Nightmare,Outcast Brewing,IIPA DIPA - Imperial / Double IPA,regular
Outcast The Forgetful Brewer,Outcast Brewing,IIPA DIPA - Imperial / Double IPA,regular
Wild Rose Flanders Ave Red Barrel Aged Series,Wild Rose Brewery (Sleeman - Sapporo),Sour Flemish Ale - Flanders Red / Oud Bruin,series seasonal
Banded Peak Plainsbreaker Pale Ale,Banded Peak Brewing,Pale Ale - American (APA),regular
Banded Peak Southern Aspect,Banded Peak Brewing,IPA,regular
Blindman Ichorous Imperial Stout - Barrel-Aged,Blindman Brewing,Stout - Imperial,special seasonal
Blindman River Session Ale,Blindman Brewing,ISA - Session IPA,regular
Great Western Original 16 Canadian Pale/Blonde Ale,Great Western Brewing (Canada),Pale Ale - American (APA),regular
Blindman Perepllut,Blindman Brewing,Barley Wine / Wheat Wine / Rye Wine,regular
Big Rock Session IPA (India Pale Ale),Big Rock Brewery,ISA - Session IPA,regular
Half Pints Weizen Heimer,Half Pints Brewing Co.,Weissbier - Hefeweizen,spring seasonal
Outcast Last Minute Stout ,Outcast Brewing,Stout,regular
Banff Ave Head Smashed IPA,Banff Ave Brewing Company (Bear Hill Brewing),IPA,regular
Alley Kat Sherbrooke KGB Russian Imperial Stout,Alley Kat Brewing Company,Stout - Imperial,special seasonal
Jasper Rock Hopper IPA,Jasper Brewing Company (Bear Hill Brewing),IPA,regular
The Dandy Dandy In the Underworld,The Dandy Brewing Company,Stout - Milk / Sweet,regular
Trial & Ale Writer’s Blanc,Trial & Ale Brewing,Sour / Wild Beer,regular
Blind Enthusiasm Union Bhoys Lager,Blind Enthusiasm,Pale Lager - International / Premium,regular
Village Maiden,Village Brewery (Canada),ISA - Session IPA,summer seasonal
Partake IPA,Partake Brewing (Premium Near Beer),Low / No Alcohol Beer - Pale,regular
Wild Rose Barracks Brown Ale,Wild Rose Brewery (Sleeman - Sapporo),Brown Ale,regular
Brewsters Mad Hops,Brewsters Brewing Company & Restaurant,IIPA DIPA - Imperial / Double IPA,summer seasonal
Torque Red Line IPA,Torque Brewing,IPA - Red,regular
Paddock Wood Czech Mate,Paddock Wood Brewing Co.,Pilsener - Bohemian / Czech,special seasonal
Half Pints Saison De La Ceinture Fléchée,Half Pints Brewing Co.,Saison / Farmhouse / Grisette,special seasonal
Big Rock Barrel-Aged Edition: Bourbon Porter,Big Rock Brewery,Porter - Imperial,series seasonal
Wild Rose Wraspberry Ale,Wild Rose Brewery (Sleeman - Sapporo),Flavored - Fruit,regular
Alley Kat Abbey Kat Belgian Style Quad,Alley Kat Brewing Company,Quadrupel / Abt,special seasonal
Black Bridge Saison Deux Fois La Taille,Black Bridge Brewery (Canada),Saison / Farmhouse / Grisette,special seasonal
Minhas Perfect 10,Minhas Micro Brewery (Minhas Brewery),Malt Liquor,regular
Nokomis Barrel Aged Imperial Stout,Nokomis Craft Ales,Stout - Imperial,special seasonal
Blindman Fortified Barley Wine,Blindman Brewing,Barley Wine / Wheat Wine / Rye Wine,regular
Paddock Wood Double Double,Paddock Wood Brewing Co.,Strong Ale - English,special seasonal
Alley Kat Ein Prosit!,Alley Kat Brewing Company,Märzen / Oktoberfest Bier,autumn seasonal
Village Wit,Village Brewery (Canada),Witbier / Belgian White Ale,regular
Blindman Port Barrel-Aged Barley Wine: Presented Still,Blindman Brewing,Barley Wine / Wheat Wine / Rye Wine,regular
Blindman Dwarf Sour Cherry,Blindman Brewing,Saison / Farmhouse - Flavored,regular
Blindman Kettle Sour # 2 (Galaxy & 06277),Blindman Brewing,Sour / Wild Beer,regular
The Establishment Afternoon Delight,The Establishment Brewing Company,Pale Ale - Hazy / New England,regular
Brewsters Honest Paul IPA,Brewsters Brewing Company & Restaurant,IPA,regular
Blindman Imperial Stout - Four Roses Bourbon Barrel-Aged,Blindman Brewing,Stout - Imperial,regular
Kilter Juicii,Kilter Brewing Co.,IPA - Hazy (NEIPA),regular
Big Rock Pilsner,Big Rock Brewery,Pilsener - Bohemian / Czech,regular
Banff Ave Reverend Rundle Stout,Banff Ave Brewing Company (Bear Hill Brewing),Stout - Dry / Irish,regular
Blindman Barrel-Aged Porter,Blindman Brewing,Porter,special seasonal
Big Rock Abandoned Abbey,Big Rock Brewery,Belgian Ale - Strong Dark,special seasonal
Cabin Super Saturation,Cabin Brewing Company,Pale Ale - Hazy / New England,regular
Big Rock McNally's Extra,Big Rock Brewery,Red Ale - Irish,regular
Troubled Monk Open Road Brown,Troubled Monk,Brown Ale,regular
Rebellion Brett Pale Ale,Rebellion Brewing Co. (Canada),Sour Flemish Ale - Flanders Red / Oud Bruin,regular
Bushwakker Revenge of the Tartan Tzar,Bushwakker Brewing Co.,Stout - Imperial,special seasonal
Alley Kat Aprikat,Alley Kat Brewing Company,Flavored - Fruit,regular
Banff Ave Lower Bankhead Black Pilsner,Banff Ave Brewing Company (Bear Hill Brewing),Schwarzbier / Black Lager,regular
Blindman Ichorous Imperial Stout - Red Wine Barrel,Blindman Brewing,Stout - Imperial,regular
Blindman Ichorous Imperial Stout - Barrel-Aged w/Toasted Coconut,Blindman Brewing,Stout - Imperial,regular
Blindman Kettle Sour # 1 (Galaxy & Mosaic),Blindman Brewing,Sour / Wild Beer,regular
Trial & Ale Separated to a Degree,Trial & Ale Brewing,Sour / Wild Beer,regular
Wild Rose Cherry Porter,Wild Rose Brewery (Sleeman - Sapporo),Porter - Flavored,winter seasonal
Brewsters Hammerhead Red Ale,Brewsters Brewing Company & Restaurant,Red Ale / International Amber Ale,regular
The Dandy Dead Moon Night,The Dandy Brewing Company,Stout - Imperial,regular
Brewsters Brewfoot Blueberry Ale,Brewsters Brewing Company & Restaurant,Flavored - Fruit,regular
Situation Declan's Irish Stout,Situation Brewing,Stout - Dry / Irish,regular
Fort Garry Pale Ale,Fort Garry Brewing,Pale Ale - English,regular
Partake Pale Ale,Partake Brewing (Premium Near Beer),Low / No Alcohol Beer - Pale,regular
Paddock Wood 1000 Monkeys Imperial Stout,Paddock Wood Brewing Co.,Stout - Imperial,special seasonal
Alley Kat Dragon Series Rainbow Dragon Double IPA ,Alley Kat Brewing Company,IIPA DIPA - Imperial / Double IPA,special seasonal
Jasper The Bear Ale,Jasper Brewing Company (Bear Hill Brewing),Witbier / Belgian White Ale,regular
Jasper Crisp Pils,Jasper Brewing Company (Bear Hill Brewing),Pilsener / Pils / Pilsner,special seasonal
The Establishment Sky Rocket IV,The Establishment Brewing Company,IPA - Hazy (NEIPA),regular
Annex Ale Project Forward Progress,Annex Ale Project,Pale Ale - American (APA),regular
Last Best Show Pony Pale,Last Best Brewing & Distilling (Bear Hill Brewing),Pale Ale - Australian / New Zealand,regular
Alley Kat Dragon Series Blue Dragon Double IPA,Alley Kat Brewing Company,IIPA DIPA - Imperial / Double IPA,series seasonal
Trial & Ale / Omen A Study of Lactic Acid Bacterial Flavour Expression As Seen Through Historical Beer Styles; a.k.a. the Transformative Properties of Wild Fermentations On Oak,Trial & Ale Brewing,Sour / Wild Beer - Dark,regular
Trial & Ale Robert,Trial & Ale Brewing,Sour / Wild Beer - Flavored,regular
Half Pints Le Temps Noir Batch Three (2019),Half Pints Brewing Co.,Stout - Imperial,regular
Barn Hammer Le Sneak Belgique,Barn Hammer Brewing Company,Witbier / Belgian White Ale,regular
Situation Imperial Sex Palace Stout,Situation Brewing,Stout - Imperial,special seasonal
Tool Shed Flat Cap Stout,Tool Shed Brewing Company,Stout,regular
Wild Rose Ponderosa Gose (Passionfruit),Wild Rose Brewery (Sleeman - Sapporo),Gose - Flavored,summer seasonal
Alley Kat Dragon Series Red Dragon Double IPA,Alley Kat Brewing Company,IIPA DIPA - Imperial / Double IPA,series seasonal
Partake Dark,Partake Brewing (Premium Near Beer),Low / No Alcohol Beer - Dark,regular
Blindman Imperial Stout - Elijah Craig Bourbon Barrel-Aged,Blindman Brewing,Stout - Imperial,regular
Alley Kat Bad Hare Day,Alley Kat Brewing Company,IIPA DIPA - Imperial / Double IPA,spring seasonal
Blindman 24-2,Blindman Brewing,Strong Ale - English,regular
Hell's Basement The Yard Pineapple Milkshake IPA,Hell's Basement Brewery,IPA - Milkshake / Smoothie,regular
Wild Rose Big DIPA,Wild Rose Brewery (Sleeman - Sapporo),IIPA DIPA - Imperial / Double IPA,autumn seasonal
Situation Pickled Padre Barley Wine,Situation Brewing,Barley Wine / Wheat Wine / Rye Wine,special seasonal
Blindman Imperial Stout - Knob Creek Bourbon Barrel-Aged,Blindman Brewing,Stout - Imperial,regular
Grizzly Paw Beavertail Raspberry Ale,The Grizzly Paw Brewing Company,Flavored - Fruit,regular
Blindman Brett Saison,Blindman Brewing,Saison / Farmhouse / Grisette,regular
Grizzly Paw Rundlestone Session Ale,The Grizzly Paw Brewing Company,Blonde Ale / Golden Ale,spring seasonal
Brewsters Curly Horse IPA,Brewsters Brewing Company & Restaurant,IPA,regular
Big Rock Winter Spice Ale,Big Rock Brewery,Flavored - Other,special seasonal
Wild Rose Rare Farmhouse White,Wild Rose Brewery (Sleeman - Sapporo),Saison / Farmhouse / Grisette,special seasonal
Cold Garden The All Nighter Vanilla Cappuccino Porter,Cold Garden Beverage Company,Porter - Flavored,regular
Torque The Witty Belgian,Torque Brewing,Witbier / Belgian White Ale,regular
Railyard Nitro Stout,Railyard Brewing,Stout,regular
