beer,brewery,style,status
Dieu du Ciel! Péché Mortel,Brasserie Dieu du Ciel!,Stout - Imperial Flavored / Pastry,special seasonal
Dieu du Ciel! Aphrodisiaque,Brasserie Dieu du Ciel!,Stout - Flavored / Pastry,regular
Unibroue La Fin du Monde,Unibroue (Sleeman - Sapporo),Tripel,regular
Unibroue Trois Pistoles,Unibroue (Sleeman - Sapporo),Belgian Ale - Strong Dark,regular
Unibroue Maudite,Unibroue (Sleeman - Sapporo),Dubbel,regular
Dieu du Ciel! Solstice d'Hiver,Brasserie Dieu du Ciel!,Barley Wine / Wheat Wine / Rye Wine,winter seasonal
St-Ambroise Noire à l'Avoine / Oatmeal Stout,Brasserie McAuslan (Brasseurs RJ),Stout - Oatmeal,regular
Dieu du Ciel! Corne du Diable,Brasserie Dieu du Ciel!,IPA - English,regular
Dieu du Ciel! Rigor Mortis Abt,Brasserie Dieu du Ciel!,Quadrupel / Abt,winter seasonal
Dieu du Ciel! Grande Noirceur,Brasserie Dieu du Ciel!,Stout - Imperial,regular
Les Trois Mousquetaires Porter Baltique,Les Trois Mousquetaires [LTM],Porter - Baltic,regular
Dieu du Ciel! Dernière Volonté,Brasserie Dieu du Ciel!,Belgian Ale - Pale / Golden / Single,regular
Unibroue Blanche de Chambly,Unibroue (Sleeman - Sapporo),Witbier / Belgian White Ale,regular
Dieu du Ciel! Équinoxe du Printemps,Brasserie Dieu du Ciel!,Scotch Ale / Wee Heavy,winter seasonal
Dieu du Ciel! / The Alchemist Moralité,Brasserie Dieu du Ciel!,IPA,regular
Unibroue Don de Dieu,Unibroue (Sleeman - Sapporo),Belgian Ale - Strong Pale,regular
Dieu du Ciel! Rosée d'Hibiscus,Brasserie Dieu du Ciel!,Flavored - Other,regular
Unibroue Terrible,Unibroue (Sleeman - Sapporo),Quadrupel / Abt,regular
Collective Arts Ransack the Universe,Collective Arts Brewing,IPA,regular
Dieu du Ciel! Péché Mortel - Bourbon,Brasserie Dieu du Ciel!,Stout - Imperial Flavored / Pastry,special seasonal
Dieu du Ciel! Solstice d'Été aux Framboises,Brasserie Dieu du Ciel!,Berliner Weisse - Flavored / Catharina Sour,summer seasonal
Dieu du Ciel! Route des Épices,Brasserie Dieu du Ciel!,Flavored - Other,regular
Unibroue 17,Unibroue (Sleeman - Sapporo),Belgian Ale - Strong Dark,special seasonal
Dieu du Ciel! Disco Soleil,Brasserie Dieu du Ciel!,IPA - Flavored,regular
Central City Red Racer IPA,Central City Brewers + Distillers,IPA,regular
Charlevoix Lupulus,Microbrasserie Charlevoix,IIPA DIPA - Imperial / Double IPA,special seasonal
Flying Monkeys Smashbomb Atomic IPA,Flying Monkeys Craft Brewery,IPA,regular
Dieu du Ciel! Isseki Nicho,Brasserie Dieu du Ciel!,Saison / Farmhouse - Dark,special seasonal
Le Trou du Diable Saison du Tracteur,Le Trou du Diable (Six Pints - Molson Coors),Saison / Farmhouse / Grisette,regular
Unibroue Éphémère Pomme / Apple,Unibroue (Sleeman - Sapporo),Flavored - Fruit,spring seasonal
Le Trou du Diable Dulcis Succubus,Le Trou du Diable (Six Pints - Molson Coors),Saison / Farmhouse / Grisette,regular
St-Ambroise Stout Impériale Russe,Brasserie McAuslan (Brasseurs RJ),Stout - Imperial,winter seasonal
St-Ambroise Vintage / Ale Millésimée,Brasserie McAuslan (Brasseurs RJ),Barley Wine / Wheat Wine / Rye Wine,autumn seasonal
Moosehead Lager,Moosehead Breweries,Pale Lager - International / Premium,regular
Dieu du Ciel! Herbe à Détourne,Brasserie Dieu du Ciel!,Tripel,regular
Dieu du Ciel! Pénombre,Brasserie Dieu du Ciel!,IPA - Black / Brown / Cascadian Dark,regular
Collective Arts Life in the Clouds,Collective Arts Brewing,IPA - Hazy (NEIPA),regular
Dieu du Ciel! Blanche du Paradis,Brasserie Dieu du Ciel!,Witbier / Belgian White Ale,regular
Charlevoix Dominus Vobiscum Triple,Microbrasserie Charlevoix,Tripel,regular
Les Trois Mousquetaires Porter Baltique (Bourbon & Brandy),Les Trois Mousquetaires [LTM],Porter - Baltic,special seasonal
Unibroue Raftman,Unibroue (Sleeman - Sapporo),Smoked - Other,regular
Flying Monkeys The Chocolate Manifesto,Flying Monkeys Craft Brewery,Stout - Imperial Flavored / Pastry,special seasonal
Le Trou du Diable La Buteuse Brassin Spécial (Calvados),Le Trou du Diable (Six Pints - Molson Coors),Tripel,regular
Le Trou du Diable La Buteuse ,Le Trou du Diable (Six Pints - Molson Coors),Tripel,regular
Le Castor Yakima IPA,Microbrasserie Le Castor Brewing Co.,IPA,regular
Driftwood Fat Tug IPA,Driftwood Brewery,IPA,regular
Les Trois Mousquetaires Doppelbock,Les Trois Mousquetaires [LTM],Bock - Doppelbock,regular
Charlevoix Dominus Vobiscum Double,Microbrasserie Charlevoix,Dubbel,regular
Unibroue Eau Bénite,Unibroue (Sleeman - Sapporo),Tripel,regular
Unibroue Quelque Chose,Unibroue (Sleeman - Sapporo),Flavored - Fruit,winter seasonal
Muskoka Mad Tom IPA,Muskoka Brewery,IPA,regular
Collective Arts Stranger Than Fiction,Collective Arts Brewing,Porter,regular
Unibroue Noire de Chambly,Unibroue (Sleeman - Sapporo),Belgian Ale - Dark / Amber,regular
Molson Canadian,Molson Canadian,\xa0\xa0•\xa0\xa0,regular
Les Trois Mousquetaires Gose,Les Trois Mousquetaires [LTM],Gose,summer seasonal
Dieu du Ciel! Chemin de Croix,Brasserie Dieu du Ciel!,Porter,series seasonal
Charlevoix Dominus Vobiscum Hibernus,Microbrasserie Charlevoix,Belgian Ale - Strong Dark,winter seasonal
St-Ambroise Abricot / Apricot Wheat Ale,Brasserie McAuslan (Brasseurs RJ),Flavored - Fruit,regular
Les Trois Mousquetaires Sticke Alt,Les Trois Mousquetaires [LTM],Altbier / Sticke Alt,series seasonal
Collective Arts Jam Up The Mash,Collective Arts Brewing,Sour / Wild Beer,special seasonal
Charlevoix Vache Folle Imperial Milk Stout,Microbrasserie Charlevoix,Stout - Imperial,regular
Dieu du Ciel! Chaman,Brasserie Dieu du Ciel!,IIPA DIPA - Imperial / Double IPA,winter seasonal
Yukon Midnight Sun Espresso Stout,Yukon Brewing,Stout - Flavored / Pastry,regular
Les Trois Mousquetaires Weizenbock,Les Trois Mousquetaires [LTM],Weissbier - Weizenbock,regular
Unibroue Megadeth À Tout Le Monde,Unibroue (Sleeman - Sapporo),Saison / Farmhouse / Grisette,special seasonal
Flying Monkeys Netherworld Cascadian Dark Ale,Flying Monkeys Craft Brewery,IPA - Black / Brown / Cascadian Dark,special seasonal
Nickel Brook Kentucky Bastard,Nickel Brook Brewing Co.,Stout - Imperial,winter seasonal
Le Trou du Diable Les Quatre Surfeurs de l'Apocalypso,Le Trou du Diable (Six Pints - Molson Coors),IPA - White,regular
Bellwoods Jelly King,Bellwoods Brewery,Sour / Wild Beer,regular
Dieu du Ciel! Solstice d'Hiver Réserve (Oak Aged / Bourbon),Brasserie Dieu du Ciel!,Barley Wine / Wheat Wine / Rye Wine,winter seasonal
Mill Street Tankhouse Ale,Mill Street Brewery (AB InBev),Pale Ale,regular
Bellwoods Bring Out Your Dead (BOYD),Bellwoods Brewery,Stout - Imperial,special seasonal
St-Ambroise Pale Ale,Brasserie McAuslan (Brasseurs RJ),Pale Ale - American (APA),regular
Le Bilboquet MacKroken Flower,Le Bilboquet - Microbrasserie / Brasserie Olten,Scotch Ale / Wee Heavy,special seasonal
Dunham / Kissmeyer Leo’s Early Breakfast,Brasserie Dunham,IPA - Flavored,regular
St-Ambroise Citrouille / Great Pumpkin Ale,Brasserie McAuslan (Brasseurs RJ),Flavored - Pumpkin / Vegetables,autumn seasonal
Flying Monkeys Hoptical Illusion,Flying Monkeys Craft Brewery,Pale Ale - American (APA),regular
Hop City Barking Squirrel,Hop City Brewing Co. (Moosehead),Amber Lager - International / Vienna,regular
Dieu du Ciel! Solstice d'Été aux Cerises,Brasserie Dieu du Ciel!,Berliner Weisse - Flavored / Catharina Sour,winter seasonal
Le Trou du Diable Sang-d'Encre,Le Trou du Diable (Six Pints - Molson Coors),Stout - Dry / Irish,regular
Dunham Saison du Pinacle,Brasserie Dunham,Saison / Farmhouse / Grisette,special seasonal
Unibroue Seigneuriale,Unibroue (Sleeman - Sapporo),Belgian Ale - Strong Pale,regular
Collective Arts Rhyme and Reason,Collective Arts Brewing,Pale Ale - American (APA),regular
Le Trou du Diable la Morsure,Le Trou du Diable (Six Pints - Molson Coors),IPA,regular
Nickel Brook Head Stock IPA,Nickel Brook Brewing Co.,IPA,regular
Muskoka Winter Beard Double Chocolate Cranberry Stout,Muskoka Brewery,Stout - Imperial Flavored / Pastry,winter seasonal
Dunham Saison Rustique,Brasserie Dunham,Saison / Farmhouse / Grisette,regular
Labatt Blue,Labatt Brewing Company (Labatt - AB InBev),Pale Lager - American,regular
Le Trou du Diable L'Impératrice Brassin Spécial (Bourbon Américain),Le Trou du Diable (Six Pints - Molson Coors),Stout - Imperial,special seasonal
Four Winds Nectarous,Four Winds Brewing Co.,Sour / Wild Beer - Flavored,special seasonal
Hopfenstark Boson de Higgs,Hopfenstark [Ho.st],Saison / Farmhouse / Grisette,regular
Flying Monkeys Juicy Ass IPA,Flying Monkeys Craft Brewery,IPA - Hazy (NEIPA),special seasonal
Unibroue La Resolution,Unibroue (Sleeman - Sapporo),Belgian Ale - Strong Dark,special seasonal
Great Lakes Brewery Canuck Pale Ale,Great Lakes Brewery (Canada),Pale Ale - American (APA),regular
Charlevoix Saison,Microbrasserie Charlevoix,Saison / Farmhouse / Grisette,autumn seasonal
Alexander Keith's India Pale Ale,Alexander Keith's Brewery / Oland Brewery (Labatt - AB InBev),Blonde Ale / Golden Ale,regular
Guinness Extra Stout (North America),Labatt Brewing Company (Labatt - AB InBev),Stout - Dry / Irish,regular
Bellwoods Jutsu,Bellwoods Brewery,Pale Ale - American (APA),regular
Collective Arts Radio The Mothership,Collective Arts Brewing,IIPA DIPA - Imperial / Double IPA,regular
Charlevoix Blanche de Charlevoix,Microbrasserie Charlevoix,Witbier / Belgian White Ale,regular
À l'Abri de la Tempête Corne de Brume,À l'Abri de la Tempête,Scotch Ale / Wee Heavy,special seasonal
Dunham Black IPA,Brasserie Dunham,IPA - Black / Brown / Cascadian Dark,special seasonal
Phillips Amnesiac Double IPA,Phillips Brewing & Malting Co.,IIPA DIPA - Imperial / Double IPA,regular
Dieu du Ciel! Immoralité,Brasserie Dieu du Ciel!,IIPA DIPA - Imperial / Double IPA,spring seasonal
Dieu du Ciel! Charbonnière,Brasserie Dieu du Ciel!,Smoked - Rauchbier,regular
Grand River Russian Gun,Grand River Brewing (Magnotta),Stout - Imperial,regular
Le Trou du Diable La Grivoise de Noël,Le Trou du Diable (Six Pints - Molson Coors),Belgian Ale - Strong Pale,winter seasonal
Dieu du Ciel! Dernière Volonté (Pinot Noir),Brasserie Dieu du Ciel!,Belgian Ale - Pale / Golden / Single,special seasonal
Dunham LaPatt Porter Robuste,Brasserie Dunham,Porter,special seasonal
Les Trois Mousquetaires Oud Bruin,Les Trois Mousquetaires [LTM],Sour Flemish Ale - Flanders Red / Oud Bruin,special seasonal
Boréale IPA du Nord-Est,Boréale - Brasseurs du Nord,IPA - Hazy (NEIPA),series seasonal
Dunham Saison Réserve,Brasserie Dunham,Saison / Farmhouse - Flavored,regular
Mill Street Cobblestone Stout,Mill Street Brewery (AB InBev),Stout - Dry / Irish,autumn seasonal
Hop City HopBot,Hop City Brewing Co. (Moosehead),IPA,regular
Collective Arts Guava Gose,Collective Arts Brewing,Gose - Flavored,regular
Mill Street Coffee Porter,Mill Street Brewery (AB InBev),Porter - Flavored,regular
Side Launch Wheat,Side Launch Brewing Company,Weissbier - Hefeweizen,regular
Bellwoods Witchshark Imperial IPA,Bellwoods Brewery,IIPA DIPA - Imperial / Double Hazy (NEIPA),regular
Dieu du Ciel! Hérétique,Brasserie Dieu du Ciel!,Sour / Wild Beer,special seasonal
Sawdust City Lone Pine IPA,Sawdust City Brewing Co.,IPA,regular
Central City Red Racer Imperial IPA (Red Betty),Central City Brewers + Distillers,IIPA DIPA - Imperial / Double IPA,special seasonal
Collective Arts Saint of Circumstance,Collective Arts Brewing,Blonde Ale / Golden Ale,regular
Bellwoods Roman Candle,Bellwoods Brewery,IPA - Hazy (NEIPA),regular
Amsterdam Boneshaker IPA,Amsterdam Brewery,IPA,regular
Wellington Imperial Russian Stout,Wellington Brewery (Canada),Stout - Imperial,regular
Great Lakes Brewery Octopus Wants to Fight - IPA,Great Lakes Brewery (Canada),IPA,special seasonal
Great Lakes Brewery 666: Devil's Pale Ale,Great Lakes Brewery (Canada),Pale Ale - American (APA),autumn seasonal
Auval Espinay,Brasserie Auval Brewing Co.,Saison / Farmhouse / Grisette,regular
Dieu du Ciel! Saison du Parc,Brasserie Dieu du Ciel!,Saison / Farmhouse / Grisette,regular
Dunham Assemblage  1,Brasserie Dunham,Sour / Wild Beer,special seasonal
Dieu du Ciel! Déesse Nocturne,Brasserie Dieu du Ciel!,Stout,regular
Le Trou du Diable L'Ours,Le Trou du Diable (Six Pints - Molson Coors),Sour / Wild Beer,special seasonal
Unibroue La Fringante,Unibroue (Sleeman - Sapporo),Tripel,regular
Hopfenstark Saison Station 16,Hopfenstark [Ho.st],Saison / Farmhouse / Grisette,spring seasonal
Le Trou du Diable Dubaï Pillée,Le Trou du Diable (Six Pints - Molson Coors),IIPA DIPA - Imperial / Double IPA,regular
Beau's Lug Tread,Beau's Brewing Co. / Halcyon Barrel House,Kölsch / Kölsch-Style,regular
Nickel Brook Café Del Bastardo,Nickel Brook Brewing Co.,Stout - Imperial Flavored / Pastry,series seasonal
Le Bilboquet La Corriveau Impériale (Bourbon),Le Bilboquet - Microbrasserie / Brasserie Olten,Stout - Imperial,regular
Le Trou du Diable Mactavish In Memoriam,Le Trou du Diable (Six Pints - Molson Coors),Pale Ale - American (APA),regular
Bellwoods Skeleton Key,Bellwoods Brewery,Stout - Imperial Flavored / Pastry,regular
Nickel Brook Winey Bastard,Nickel Brook Brewing Co.,Stout - Imperial,special seasonal
Hopfenstark Saison Station 55,Hopfenstark [Ho.st],IPA - Belgian / Saison,autumn seasonal
Dieu du Ciel! Péché Véniel,Brasserie Dieu du Ciel!,Stout - Flavored / Pastry,special seasonal
Le Castor Wee Heavy (Bourbon),Microbrasserie Le Castor Brewing Co.,Scotch Ale / Wee Heavy,regular
Dieu du Ciel! Voyageur des Brumes,Brasserie Dieu du Ciel!,Bitter - Premium / Strong / Extra Special (ESB),regular
Creemore Springs Premium Lager,Creemore Springs Brewery (Six Pints - Molson Coors),Pale Lager - International / Premium,regular
Unibroue Éphémère Cassis / Blackcurrant,Unibroue (Sleeman - Sapporo),Flavored - Fruit,autumn seasonal
Collective Arts Imperial Porter - Barrel-Aged (2017-),Collective Arts Brewing,Porter - Imperial,regular
Vox Populi Double Fruit Punch IPA,Microbrasserie Vox Populi (Groupe Glutenberg),IIPA DIPA - Imperial / Double IPA,regular
Simple Malt Noire Majestueuse,Simple Malt - Brasseurs Illimités,Stout - Imperial,regular
Charlevoix Flacatoune,Microbrasserie Charlevoix,Belgian Ale - Pale / Golden / Single,regular
Nickel Brook Naughty Neighbour,Nickel Brook Brewing Co.,Pale Ale - American (APA),regular
À l'Abri de la Tempête Corps Mort,À l'Abri de la Tempête,Barley Wine / Wheat Wine / Rye Wine,regular
Muskoka Twice As Mad Tom,Muskoka Brewery,IIPA DIPA - Imperial / Double IPA,special seasonal
Dieu du Ciel! Dernière Volonté - Brettanomyces,Brasserie Dieu du Ciel!,Sour / Wild Beer,special seasonal
Driftwood Old Cellar Dweller Barleywine,Driftwood Brewery,Barley Wine / Wheat Wine / Rye Wine,regular
Dieu du Ciel! Petit Détour,Brasserie Dieu du Ciel!,IPA,regular
Muskoka Detour,Muskoka Brewery,ISA - Session IPA,regular
Les Trois Mousquetaires Saison Brett,Les Trois Mousquetaires [LTM],Saison / Farmhouse / Grisette,special seasonal
Cameron's Obsidian Imperial Porter Rum Barrel Aged,Cameron's Brewing,Porter - Imperial,special seasonal
Beyond the Pale Aromatherapy - American IPA,Beyond the Pale Brewing Company,IPA - Hazy (NEIPA),regular
Charlevoix La Vache Folle ESB,Microbrasserie Charlevoix,Bitter - Premium / Strong / Extra Special (ESB),regular
Black Oak 10 Bitter Years,Black Oak Brewing Co.,IIPA DIPA - Imperial / Double IPA,special seasonal
Les Trois Mousquetaires Pale Ale Américaine ,Les Trois Mousquetaires [LTM],Pale Ale - American (APA),series seasonal
St-Ambroise India Pale Ale,Brasserie McAuslan (Brasseurs RJ),IPA,regular
Muskoka Harvest Ale,Muskoka Brewery,Pale Ale - American (APA),autumn seasonal
Les Trois Mousquetaires IPA,Les Trois Mousquetaires [LTM],IPA,regular
Pit Caribou La Gaspésienne,Microbrasserie Pit Caribou,Porter,regular
Collective Arts Hazy State,Collective Arts Brewing,ISA - Session IPA,regular
Dunham Propolis,Brasserie Dunham,Saison / Farmhouse - Flavored,regular
Steam Whistle Pilsner,Steam Whistle Brewing,Pale Lager - International / Premium,regular
Driftwood Singularity Russian Imperial Stout,Driftwood Brewery,Stout - Imperial,regular
Rickard's Red,Rickard's Red,\xa0\xa0•\xa0\xa0,regular
Dieu du Ciel! Péché Mortel - Édition Spéciale 2016 - 2017,Brasserie Dieu du Ciel!,Stout - Imperial Flavored / Pastry,special seasonal
Charlevoix Vache Folle RyePA,Microbrasserie Charlevoix,IPA - Rye,regular
Le Bilboquet La Corriveau,Le Bilboquet - Microbrasserie / Brasserie Olten,Stout - Oatmeal,regular
Dunham Petite Mort,Brasserie Dunham,Stout - Imperial,regular
Beau's Full Time IPA,Beau's Brewing Co. / Halcyon Barrel House,IPA,regular
Hopfenstark Saison Station 7,Hopfenstark [Ho.st],Saison / Farmhouse / Grisette,regular
Dieu du Ciel! Isseki Nicho (Pinot Noir),Brasserie Dieu du Ciel!,Saison / Farmhouse - Dark,regular
Muskoka Legendary Muskoka Oddity,Muskoka Brewery,Flavored - Other,spring seasonal
Sleeman Honey Brown Lager,Sleeman Breweries (Sapporo),Amber Lager - International / Vienna,regular
Le Trou du Diable Shawi Beach,Le Trou du Diable (Six Pints - Molson Coors),IPA,regular
Alchimiste Eisbock,Alchimiste - Microbrasserie (Vilains Brasseurs),Bock - Eisbock,winter seasonal
Le Trou du Diable Baron Noir,Le Trou du Diable (Six Pints - Molson Coors),Porter - Baltic,regular
Alley Kat Olde Deuteronomy Barley Wine,Alley Kat Brewing Company,Barley Wine / Wheat Wine / Rye Wine,winter seasonal
Dieu du Ciel! Blanche Neige,Brasserie Dieu du Ciel!,Belgian Ale - Strong Pale,winter seasonal
Pit Caribou IPA Américaine des Appalaches,Microbrasserie Pit Caribou,IPA,series seasonal
Les Trois Mousquetaires Maibock,Les Trois Mousquetaires [LTM],Bock - Heller Bock / Maibock,regular
Dunham Stout Impériale Russe,Brasserie Dunham,Stout - Imperial,regular
Dieu du Ciel! La Païenne,Brasserie Dieu du Ciel!,Blonde Ale / Golden Ale,regular
Les Trois Mousquetaires Barleywine Américain,Les Trois Mousquetaires [LTM],Barley Wine / Wheat Wine / Rye Wine,special seasonal
Superflux Colour & Shape,Superflux Beer Company,IPA - Hazy (NEIPA),regular
Dieu du Ciel! Péché Mortel - Termopilas,Brasserie Dieu du Ciel!,Stout - Imperial Flavored / Pastry,special seasonal
Les Trois Mousquetaires Déjeuner Impérial,Les Trois Mousquetaires [LTM],Stout - Imperial Flavored / Pastry,special seasonal
Great Lakes Brewery Karma Citra,Great Lakes Brewery (Canada),IPA,special seasonal
Steamworks Pale Ale,Steamworks Brewing Co. (Canada),Pale Ale - American (APA),regular
Bellwoods Hellwoods,Bellwoods Brewery,Stout - Imperial,regular
Great Lakes Brewery Lake Effect IPA,Great Lakes Brewery (Canada),IPA,series seasonal
Le Castor L'Éclipse,Microbrasserie Le Castor Brewing Co.,IPA - Black / Brown / Cascadian Dark,regular
Dieu du Ciel! Sentinelle,Brasserie Dieu du Ciel!,Kölsch / Kölsch-Style,regular
Howe Sound Woolly Bugger,Howe Sound Brewing,Barley Wine / Wheat Wine / Rye Wine,winter seasonal
Dieu du Ciel! Genèse,Brasserie Dieu du Ciel!,Tripel,special seasonal
Central City Thor's Hammer Barley Wine,Central City Brewers + Distillers,Barley Wine / Wheat Wine / Rye Wine,special seasonal
Unibroue Éphémère Canneberge / Cranberry,Unibroue (Sleeman - Sapporo),Flavored - Fruit,winter seasonal
RJ Blonde d'Achouffe,Brasseurs RJ,Belgian Ale - Strong Pale,regular
Collective Arts State of Mind,Collective Arts Brewing,ISA - Session IPA,special seasonal
Amsterdam Tempest Imperial Stout,Amsterdam Brewery,Stout - Imperial,special seasonal
Dunham Tropicale IPA,Brasserie Dunham,IPA - Flavored,special seasonal
Collective Arts Good Monster,Collective Arts Brewing,IIPA DIPA - Imperial / Double Hazy (NEIPA),regular
Dunham Rye ESB,Brasserie Dunham,Bitter - Premium / Strong / Extra Special (ESB),regular
Dieu du Ciel! Ultra Mosaika,Brasserie Dieu du Ciel!,Pale Ale - American (APA),regular
Le Castor Citra Weisse,Microbrasserie Le Castor Brewing Co.,Wheat Ale - India / Hopfenweisse,summer seasonal
Steamworks Flagship Hazy IPA,Steamworks Brewing Co. (Canada),IPA - Hazy (NEIPA),regular
Garrison Imperial I.P.A.,Garrison Brewing Company,IPA,regular
Les Trois Mousquetaires Berliner Weisse,Les Trois Mousquetaires [LTM],Berliner Weisse,summer seasonal
Cameron's Rye Pale Ale,Cameron's Brewing,Pale Ale - Rye,regular
Pit Caribou Kriek Porter,Microbrasserie Pit Caribou,Porter - Flavored,special seasonal
Dieu du Ciel! Équinoxe du Printemps (Fût de Chêne),Brasserie Dieu du Ciel!,Scotch Ale / Wee Heavy,regular
Les Trois Mousquetaires Réserve de Noël,Les Trois Mousquetaires [LTM],Flavored - Other,winter seasonal
Dunham Assemblage  2,Brasserie Dunham,Sour / Wild Beer,special seasonal
Le Trèfle Noir Chernoe Pivo,Le Trèfle Noir - Brasserie Artisanale,Stout - Imperial,regular
Alchimiste Imperial Stout,Alchimiste - Microbrasserie (Vilains Brasseurs),Stout - Imperial,special seasonal
Jukebox Distorsion,Bières Jukebox (Avant-Garde),IPA,regular
Dieu du Ciel! L'Exorciste,Brasserie Dieu du Ciel!,Sour / Wild Beer,special seasonal
Beyond the Pale Saison Tropicale,Beyond the Pale Brewing Company,Saison / Farmhouse / Grisette,special seasonal
Le Trou du Diable Aldred,Le Trou du Diable (Six Pints - Molson Coors),Saison / Farmhouse / Grisette,regular
Nickel Brook Bolshevik Bastard,Nickel Brook Brewing Co.,Stout - Imperial,regular
Dunham SuperMoine 3 Deze Monnik Is Dronken,Brasserie Dunham,Quadrupel / Abt,regular
Moosehead Pale Ale,Moosehead Breweries,Blonde Ale / Golden Ale,regular
St-Ambroise Scotch Ale,Brasserie McAuslan (Brasseurs RJ),Scotch Ale / Wee Heavy,winter seasonal
Sleeman Cream Ale,Sleeman Breweries (Sapporo),Cream Ale,regular
Boréale Noire,Boréale - Brasseurs du Nord,Stout,regular
Mill Street Original Organic Lager,Mill Street Brewery (AB InBev),Pale Lager - International / Premium,regular
Nickel Brook Immodest Imperial India Pale Ale,Nickel Brook Brewing Co.,IIPA DIPA - Imperial / Double IPA,special seasonal
Steamworks Jasmine IPA,Steamworks Brewing Co. (Canada),IPA - Flavored,special seasonal
RJ Coup de Grisou,Brasseurs RJ,Specialty Grain - Other,regular
Propeller ESB,Propeller Brewing Co.,Bitter - Premium / Strong / Extra Special (ESB),regular
Brasseurs du Monde L'Exploité,Brasseurs du Monde,Stout - Milk / Sweet,regular
Mill Street Barley Wine,Mill Street Brewery (AB InBev),Barley Wine / Wheat Wine / Rye Wine,winter seasonal
Auval Ribes Nigrum (Cassis),Brasserie Auval Brewing Co.,Sour / Wild Beer - Flavored,regular
Central City Session India Pale Ale,Central City Brewers + Distillers,ISA - Session IPA,regular
Granville Island English Bay Pale Ale,Granville Island Brewing (Six Pints - Molson Coors),Pale Ale - English,regular
Indie Alehouse Instigator IPA,Indie Alehouse Brewing Co.,IPA,regular
Unibroue Blonde de Chambly,Unibroue (Sleeman - Sapporo),Saison / Farmhouse / Grisette,regular
Propeller IPA,Propeller Brewing Co.,IPA,special seasonal
Le Trou du Diable Le Coq,Le Trou du Diable (Six Pints - Molson Coors),Sour / Wild Beer - Flavored,special seasonal
Kokanee,Columbia Brewery - Kokanee Beer (Labatt - AB InBev),Pale Lager - American,regular
Le Trou du Diable La Pitoune Keller Pils,Le Trou du Diable (Six Pints - Molson Coors),Zwickelbier / Kellerbier / Landbier,regular
Unibroue Ale Gâteau Forêt-Noire,Unibroue (Sleeman - Sapporo),Belgian Ale - Strong Dark,regular
Les Trois Mousquetaires Dixième,Les Trois Mousquetaires [LTM],Sour / Wild Beer - Dark,special seasonal
Dieu du Ciel! AphroRhum,Brasserie Dieu du Ciel!,Stout - Flavored / Pastry,special seasonal
Great Lakes Brewery Pompous Ass,Great Lakes Brewery (Canada),Pale Ale - English,regular
Le Bilboquet MacKroken Flower Grande Réserve (Fût de Chêne),Le Bilboquet - Microbrasserie / Brasserie Olten,Scotch Ale / Wee Heavy,special seasonal
Pit Caribou Barleywine Américain,Microbrasserie Pit Caribou,Barley Wine / Wheat Wine / Rye Wine,regular
Four Winds Juxtapose,Four Winds Brewing Co.,IPA - Sour / Wild,special seasonal
Auval Arrière-Pays,Brasserie Auval Brewing Co.,Saison / Farmhouse / Grisette,regular
Simple Malt Calumet,Simple Malt - Brasseurs Illimités,Porter - Smoked,regular
Bellwoods White Picket Fence Foeder Blended Saison,Bellwoods Brewery,Saison / Farmhouse / Grisette,special seasonal
Steamworks Killer Cucumber Ale,Steamworks Brewing Co. (Canada),Flavored - Pumpkin / Vegetables,spring seasonal
Les Trois Mousquetaires Oktoberfest,Les Trois Mousquetaires [LTM],Märzen / Oktoberfest Bier,autumn seasonal
Dunham Orange de Dunham,Brasserie Dunham,Sour Flemish Ale - Flanders Red / Oud Bruin,special seasonal
Dieu du Ciel! / Le Trou Du Diable La Divine Comédie,Brasserie Dieu du Ciel!,Pilsener / Pils / Pilsner,regular
Beau's The Bottle Imp,Beau's Brewing Co. / Halcyon Barrel House,Stout - Imperial Flavored / Pastry,regular
Half Pints Burlywine,Half Pints Brewing Co.,Barley Wine / Wheat Wine / Rye Wine,winter seasonal
Phillips Hop Circle IPA,Phillips Brewing & Malting Co.,IPA,regular
Propeller Revolution Russian Imperial Stout,Propeller Brewing Co.,Stout - Imperial,winter seasonal
Le Trou du Diable Mellifera,Le Trou du Diable (Six Pints - Molson Coors),Saison / Farmhouse - Flavored,regular
Central City Red Racer Northwest Pale Ale,Central City Brewers + Distillers,Pale Ale - American (APA),regular
Dieu du Ciel! Péché Mortel - Pêches,Brasserie Dieu du Ciel!,Stout - Imperial Flavored / Pastry,regular
Nickel Brook Uber (Raspberry),Nickel Brook Brewing Co.,Berliner Weisse - Flavored / Catharina Sour,regular
Bellwoods Grandma's Boy (2016 - ),Bellwoods Brewery,Sour / Wild Beer - Flavored,special seasonal
Dunham No Tahoma Farmhouse Ale,Brasserie Dunham,Saison / Farmhouse / Grisette,special seasonal
Dunham / Kissmeyer La Résurrection de Broderus,Brasserie Dunham,Saison / Farmhouse - Flavored,winter seasonal
Simple Malt Cascade Qc,Simple Malt - Brasseurs Illimités,IPA,regular
Church-Key Holy Smoke,Church-Key Brewing Company,Smoked - Rauchbier,regular
Flying Monkeys Live Transmission ,Flying Monkeys Craft Brewery,IPA - Milkshake / Smoothie,regular
