beer,brewery,style,status
À La Fût Cowsure ,À La Fût - Microbrasserie (Canada),Sour / Wild Beer,special seasonal
Steamworks YVR ISA,Steamworks Brewing Co. (Canada),ISA - Session IPA,regular
Blood Brothers Shumei IPA,Blood Brothers Brewing,IPA,regular
Indie Alehouse Cockpuncher,Indie Alehouse Brewing Co.,IIPA DIPA - Imperial / Double IPA,regular
La Chouape Stout Impériale,Brasserie La Chouape Brewing Co.,Stout - Imperial,regular
Dieu du Ciel! Castelnau,Brasserie Dieu du Ciel!,Brown Ale,regular
Pit Caribou / Auval / Sutton Brouërie PAB,Microbrasserie Pit Caribou,Sour / Wild Beer - Flavored,regular
St-Ambroise Porter Impérial (Bourbon),Brasserie McAuslan (Brasseurs RJ),Porter - Imperial,series seasonal
Le Naufrageur La Pénélope Pilsner Tchèque,Microbrasserie Le Naufrageur,Pilsener / Pils / Pilsner,regular
Le Castor Aussieland,Microbrasserie Le Castor Brewing Co.,IPA - Hazy (NEIPA),regular
Le Castor Sanctuaire Brett 2017+ (Vin Rouge),Microbrasserie Le Castor Brewing Co.,Tripel,winter seasonal
Simple Malt Doppelbock,Simple Malt - Brasseurs Illimités,Bock - Doppelbock,regular
À l'Abri de la Tempête Trans IPA,À l'Abri de la Tempête,Pale Lager - Hoppy / India (IPL),regular
Dunham / Browar Widawa Mroczny Pan (Bourbon),Brasserie Dunham,Porter - Baltic,special seasonal
Bas-Canada Espace Libre,Brasserie du Bas-Canada,IPA - Hazy (NEIPA),regular
L'Amère à Boire Éléphant Tmavé,Brasserie Artisanale L'Amère à Boire,Dark Lager - Dunkel / Tmavý,special seasonal
Collective Arts / Cloudwater Origin of Darkness,Collective Arts Brewing,Stout - Imperial Flavored / Pastry,regular
Pit Caribou Berliner Weisse,Microbrasserie Pit Caribou,Berliner Weisse,special seasonal
Tree Hefeweizen,Tree Brewing Co. (Fireweed Brewing Corp),Weissbier - Hefeweizen,summer seasonal
Picaroons Best Bitter,Picaroons Brewing Company,Bitter - Premium / Strong / Extra Special (ESB),regular
Du Lac Saint-Jean Gros Mollet Lumber Jack,Microbrasserie Du Lac Saint-Jean,Belgian Ale - Strong Dark,regular
Le Trou du Diable La Bretteuse Brassin Spécial (Zinfandel - Pinot Noir),Le Trou du Diable (Six Pints - Molson Coors),IPA - Sour / Wild,special seasonal
Dunham / L’Ermitage Le Jugement,Brasserie Dunham,Pale Lager - Hoppy / India (IPL),special seasonal
Phillips Short Wave West Coast Pale Ale,Phillips Brewing & Malting Co.,Pale Ale - American (APA),regular
Bellwoods / Evil Twin Brewing No Sleep Till Brooklyn,Bellwoods Brewery,Sour / Wild Beer - Dark,regular
Boombox Juicy AF (2017-),Boombox Brewing Company,IPA - Hazy (NEIPA),regular
Bas-Canada Mirage,Brasserie du Bas-Canada,IIPA DIPA - Imperial / Double IPA,regular
Thornbury Village Dam Dark Lager,Thornbury Village Craft Cider & Beer,Dark Lager - Dunkel / Tmavý,regular
Bas-Canada Substance,Brasserie du Bas-Canada,Stout - Imperial Flavored / Pastry,regular
Riverbend Impériale Stout ,Riverbend - Microbrasserie,Stout - Imperial,regular
Side Launch Mountain Lager,Side Launch Brewing Company,Helles / Dortmunder Export,summer seasonal
Beau's Golden Vox,Beau's Brewing Co. / Halcyon Barrel House,Specialty Grain - Rye / Roggenbier,regular
Tree Kelowna Pilsner,Tree Brewing Co. (Fireweed Brewing Corp),Pilsener / Pils / Pilsner,regular
Collective Arts IPA No. 11,Collective Arts Brewing,IPA - Hazy (NEIPA),regular
Le Trèfle Noir California,Le Trèfle Noir - Brasserie Artisanale,IPA,regular
L'Amère à Boire Cosaque,Brasserie Artisanale L'Amère à Boire,Porter - Baltic,regular
Lake of Bays Spark House,Lake of Bays Brewing Co.,Red Ale / International Amber Ale,regular
La Barberie Rousse Bitter,Microbrasserie La Barberie,Bitter - Ordinary / Best,regular
Dunham Stout Impériale Russe (Tokai),Brasserie Dunham,Stout - Imperial,special seasonal
Brasseur de Montréal Préfontaine,Brasseur de Montréal (Six Pints - Molson Coors),Witbier / Belgian White Ale,regular
Great Lakes Brewery Limp Puppet ,Great Lakes Brewery (Canada),ISA - Session IPA,summer seasonal
Boréale Nokturn Black IPA Noire,Boréale - Brasseurs du Nord,IPA - Black / Brown / Cascadian Dark,special seasonal
Garrison Tall Ship,Garrison Brewing Company,Red Ale / International Amber Ale,regular
Bellwoods / Other Half Mylarshark,Bellwoods Brewery,IIPA DIPA - Imperial / Double IPA,regular
Collective Arts Matter Of Fact,Collective Arts Brewing,Blonde Ale / Golden Ale,regular
"Collective Arts Surround Sound: Azacca, Amarillo & Comet",Collective Arts Brewing,Amarillo & Comet',regular
Boréale Cap Citra,Boréale - Brasseurs du Nord,Saison / Farmhouse / Grisette,series seasonal
Beau's Farm Table: Grisette,Beau's Brewing Co. / Halcyon Barrel House,Traditional Ale - Other,regular
Flying Monkeys Stereo Vision,Flying Monkeys Craft Brewery,Red Ale / International Amber Ale,special seasonal
Benelux Anniversaire (Sherbrooke) ,Benelux - Brasserie Artisanale / Brasserie du Canal,IIPA DIPA - Imperial / Double IPA,special seasonal
Molson John H.R. Molson & Bros 1908,Molson John H.R. Molson & Bros 1908,\xa0\xa0•\xa0\xa0,special seasonal
Garrison Spruce Beer,Garrison Brewing Company,Flavored - Other,special seasonal
Le Grimoire Goliath,Grimoire - Microbrasserie,Scotch Ale / Wee Heavy,special seasonal
Pit Caribou La Bonne Aventure,Microbrasserie Pit Caribou,Red Ale / International Amber Ale,regular
Tofino Kelp Stout,Tofino Brewing Company,Stout,regular
Russell IP'eh,Russell Brewing Co.,IPA,regular
"Nickel Brook Metal Head - Citra, Simcoe and Ekuanot",Nickel Brook Brewing Co.,Simcoe and Ekuanot',regular
Mill Street Oktoberfest Style,Mill Street Brewery (AB InBev),Märzen / Oktoberfest Bier,autumn seasonal
Beau's Koru,Beau's Brewing Co. / Halcyon Barrel House,Belgian Ale - Pale / Golden / Single,special seasonal
Grand River Curmudgeon IPA,Grand River Brewing (Magnotta),IPA - English,special seasonal
Dunham Bière de Table,Brasserie Dunham,Belgian Ale - Pale / Golden / Single,summer seasonal
Dunham IPA Anglaise,Brasserie Dunham,IPA - English,regular
Bellwoods Jelly King (Tangerine),Bellwoods Brewery,Sour / Wild Beer - Flavored,regular
Stalwart Dr. Feelgood,Stalwart Brewing Co.,IPA,regular
Howe Sound Rail Ale,Howe Sound Brewing,Brown Ale,regular
Sleeman Silver Creek Lager,Sleeman Breweries (Sapporo),Pale Lager - American,regular
Boréale Diamant Brut,Boréale - Brasseurs du Nord,IPA - Brut,regular
3 Brasseurs La Belle Province,3 Brasseurs / 3 Brewers (Canada),Belgian Ale - Dark / Amber,special seasonal
Alexander Keith's Nova Scotia Style Pale Ale,Alexander Keith's Brewery / Oland Brewery (Labatt - AB InBev),Pale Ale - English,regular
Vox Populi Anna Assemblage,Microbrasserie Vox Populi (Groupe Glutenberg),Tripel,regular
Unibroue Éphémère Sureau / Elderberry,Unibroue (Sleeman - Sapporo),Flavored - Fruit,spring seasonal
Hopfenstark Capitain Swing,Hopfenstark [Ho.st],Barley Wine / Wheat Wine / Rye Wine,special seasonal
Sawdust City + Arendals Little Norway,Sawdust City Brewing Co.,Pale Lager - American,regular
Le Castor Kleine Weisse,Microbrasserie Le Castor Brewing Co.,Berliner Weisse,summer seasonal
Pit Caribou Bitter,Microbrasserie Pit Caribou,Bitter - Ordinary / Best,regular
L'Amère à Boire Éléphant 10°,Brasserie Artisanale L'Amère à Boire,Pilsener - Bohemian / Czech,regular
Bedondaine et Bedons Ronds Dernière Brosse,Bedondaine et Bedons Ronds - Brasseur Artisan,Stout - Extra / Foreign / Tropical,regular
Dunham Saison Fleurs Réserve,Brasserie Dunham,Saison / Farmhouse - Flavored,regular
Pit Caribou / Le Castor 30 Cents Black IPA Noire - Nelson Sauvin,Microbrasserie Pit Caribou,IPA - Black / Brown / Cascadian Dark,special seasonal
Driftwood White Bark Witbier,Driftwood Brewery,Witbier / Belgian White Ale,regular
Dieu du Ciel! Péché Mortel - Cassis Blackcurrant,Brasserie Dieu du Ciel!,Stout - Imperial Flavored / Pastry,regular
Driftwood Crooked Coast Altbier,Driftwood Brewery,Altbier / Sticke Alt,regular
Bellwoods Milkshark - Vanilla,Bellwoods Brewery,IPA - Milkshake / Smoothie,regular
À La Fût British,À La Fût - Microbrasserie (Canada),Brown Ale,regular
L'Amère à Boire Vollbier,Brasserie Artisanale L'Amère à Boire,Amber Lager - International / Vienna,regular
Flying Monkeys Heartbreak,Flying Monkeys Craft Brewery,Porter,spring seasonal
Hopfenstark Kluskap O'Kom,Hopfenstark [Ho.st],Flavored - Other,regular
Hop City Mr. Huff Pale Ale,Hop City Brewing Co. (Moosehead),Pale Ale - American (APA),regular
Dieu du Ciel! déCIBeL,Brasserie Dieu du Ciel!,Pale Ale - American (APA),regular
Wellington Chocolate Milk Stout,Wellington Brewery (Canada),Stout - Milk / Sweet,special seasonal
Le Naufrageur Colborne,Microbrasserie Le Naufrageur,Red Ale / International Amber Ale,regular
Dieu du Ciel! Hors Saison,Brasserie Dieu du Ciel!,Saison / Farmhouse / Grisette,regular
Oast House Saison,Oast House Brewers,Saison / Farmhouse / Grisette,regular
Simple Malt Série Limitée - OR,Simple Malt - Brasseurs Illimités,Strong Ale - American,special seasonal
Left Field Bricks & Mortar,Left Field Brewery,Porter - Flavored,regular
Les Grands Bois Superpause,Les Grands Bois - Microbrasserie,IPA,regular
Bellwoods Foeder Fermented Grisette,Bellwoods Brewery,Saison / Farmhouse / Grisette,regular
RJ Tord-Vis,Brasseurs RJ,Belgian Ale - Pale / Golden / Single,winter seasonal
Paddock Wood Barrel Full of Monkeys Imperial Stout,Paddock Wood Brewing Co.,Stout - Imperial,special seasonal
Dieu du Ciel! Rigor Mortis Tripel,Brasserie Dieu du Ciel!,Tripel,regular
Brasseurs du Monde Big Ben Porter,Brasseurs du Monde,Porter,regular
Phillips Bottle Rocket ISA,Phillips Brewing & Malting Co.,ISA - Session IPA,regular
Dunham Saison Framboise (Zinfandel),Brasserie Dunham,Saison / Farmhouse - Flavored,special seasonal
Collective Arts / Burial Origin of Darkness,Collective Arts Brewing,Stout - Imperial Flavored / Pastry,regular
Bas-Canada La Torre,Brasserie du Bas-Canada,Stout - Imperial Flavored / Pastry,regular
Hopfenstark LouLou Porter 1929,Hopfenstark [Ho.st],Porter,regular
Le Trou du Diable Boisson d'Avril,Le Trou du Diable (Six Pints - Molson Coors),Pilsener / Pils / Pilsner,special seasonal
Glutenberg Impérial Sotolon 2014+ (Rhum Brun),Microbrasserie Glutenberg (Groupe Glutenberg),Specialty Grain - Other,spring seasonal
Lagabière La Poudre Jaune,Lagabière - Brasserie Artisanale,Sour / Wild Beer,regular
Brasseurs du Monde L'Assoiffé 10,Brasseurs du Monde,Tripel,special seasonal
Le Castor Roselle,Microbrasserie Le Castor Brewing Co.,Sour / Wild Beer - Flavored,regular
Les 2 Frères Charles Henri Blanche ,Brasserie Les 2 Frères,Witbier / Belgian White Ale,regular
Dunham Petite Mort (Tokaji),Brasserie Dunham,Stout - Imperial,regular
Bas-Canada Standish Hall,Brasserie du Bas-Canada,IPA - Hazy (NEIPA),regular
Bas-Canada Vertige,Brasserie du Bas-Canada,IIPA DIPA - Imperial / Double IPA,regular
Bas-Canada Toxicité,Brasserie du Bas-Canada,Stout - Flavored / Pastry,regular
Beauregard Impériale Extra Bourbon,Beauregard - Brasserie Distillerie,Stout - Imperial,regular
Beyond the Pale Imperial Super Guy,Beyond the Pale Brewing Company,IPA - Rye,regular
De l'Île d'Orléans Éléonore de Grandmaison,Microbrasserie de l'Île d'Orléans (Haacht),Red Ale / International Amber Ale,regular
Fort Garry Kona Imperial Stout,Fort Garry Brewing,Stout - Imperial Flavored / Pastry,series seasonal
Paddock Wood London Porter,Paddock Wood Brewing Co.,Porter,special seasonal
La Barberie Blonde au Chardonnay ,Microbrasserie La Barberie,Flavored - Fruit,special seasonal
Le Trèfle Noir Joannès,Le Trèfle Noir - Brasserie Artisanale,Berliner Weisse - Flavored / Catharina Sour,regular
Dunham Grisette de Dunham,Brasserie Dunham,Saison / Farmhouse / Grisette,special seasonal
Bellwoods Skeleton Key (Espresso),Bellwoods Brewery,Stout - Imperial Flavored / Pastry,regular
Dunham LaPatt Porter Robuste (Whisky Canadien),Brasserie Dunham,Porter,regular
Charlevoix Vache Folle Palisade Double IPA,Microbrasserie Charlevoix,IIPA DIPA - Imperial / Double IPA,special seasonal
Shelton Sure aux Framboises,Bièrerie Shelton,Sour / Wild Beer - Flavored,regular
Boréale / Sir John Ursidae,Boréale - Brasseurs du Nord,IIPA DIPA - Imperial / Double Hazy (NEIPA),regular
Benelux Barley Wine,Benelux - Brasserie Artisanale / Brasserie du Canal,Barley Wine / Wheat Wine / Rye Wine,winter seasonal
Half Pints Pothole Porter,Half Pints Brewing Co.,Porter - Baltic,spring seasonal
The Granite Hopping Mad,The Granite Brewery & Tied House,Pale Ale - American (APA),special seasonal
Russell Blood Alley Bitter,Russell Brewing Co.,Bitter - Premium / Strong / Extra Special (ESB),special seasonal
Four Winds Edna,Four Winds Brewing Co.,Sour / Wild Beer,special seasonal
Matera Réal XX,Matera - Brasseurs Tonneliers,IIPA DIPA - Imperial / Double IPA,regular
Farnham 64 India Pale Ale,Farnham - Ale & Lager (Canada),IPA,regular
Amsterdam Spring Bock,Amsterdam Brewery,Bock - Dunkler Bock,spring seasonal
Lion d'Or Lion's Pride,Lion d'Or / Golden Lion Pub & Brewery,Brown Ale,regular
Vox Populi Vox Pop IPA - Simcoe,Microbrasserie Vox Populi (Groupe Glutenberg),IPA,regular
Dunham Jane Doe - Assemblage Hors-Série  5,Brasserie Dunham,Sour / Wild Beer - Dark,special seasonal
Collective Arts Stranger Than Chocolate & Coconut Porter,Collective Arts Brewing,Porter - Flavored,regular
Boréale Dorée,Boréale - Brasseurs du Nord,Blonde Ale / Golden Ale,regular
Vox Populi Hazel,Microbrasserie Vox Populi (Groupe Glutenberg),Brown Ale,regular
Garrison Juicy! Double IPA,Garrison Brewing Company,IIPA DIPA - Imperial / Double IPA,regular
Pit Caribou IIPA de la Sorcière V2,Microbrasserie Pit Caribou,IIPA DIPA - Imperial / Double IPA,special seasonal
Granville Island Cypress Honey Lager,Granville Island Brewing (Six Pints - Molson Coors),Pale Lager - American,regular
Blindman New England-Style Pale Ale,Blindman Brewing,Pale Ale - Hazy / New England,special seasonal
Boréale Tête Brûlée,Boréale - Brasseurs du Nord,Stout - Flavored / Pastry,regular
Du Lièvre IPA du Lièvre,Microbrasserie Du Lièvre,IPA,regular
Phillips Slipstream Ale,Phillips Brewing & Malting Co.,Cream Ale,regular
Alexander Keith's Premium White,Alexander Keith's Brewery / Oland Brewery (Labatt - AB InBev),Witbier / Belgian White Ale,regular
Sutton Brouërie Bobonom,Sutton Brouërie,Pale Ale - American (APA),regular
Bellwoods Farmhouse Saison,Bellwoods Brewery,Saison / Farmhouse / Grisette,regular
Le Castor Lutine,Microbrasserie Le Castor Brewing Co.,IIPA DIPA - Imperial / Double Hazy (NEIPA),regular
Albion Chiniquy,Brasserie Artisanale Albion,Mild Ale,regular
Steamworks Kölsch (Kanadische Kölsch),Steamworks Brewing Co. (Canada),Kölsch / Kölsch-Style,summer seasonal
Collective Arts / Stillwater Blueberry Chocolate Coffee & Vanilla Sour,Collective Arts Brewing,Sour / Wild Beer - Flavored,regular
Pit Caribou La York ,Microbrasserie Pit Caribou,Saison / Farmhouse - Flavored,regular
Bas-Canada Crime & Châtiment (Bourbon),Brasserie du Bas-Canada,Stout - Imperial,regular
Le Trou du Diable Saison du Tongka,Le Trou du Diable (Six Pints - Molson Coors),Saison / Farmhouse / Grisette,regular
Pit Caribou Carter,Microbrasserie Pit Caribou,Brown Ale - Imperial,special seasonal
Du Lac Saint-Jean Frappabord,Microbrasserie Du Lac Saint-Jean,Barley Wine / Wheat Wine / Rye Wine,regular
Unibroue Megadeth Saison 13,Unibroue (Sleeman - Sapporo),Saison / Farmhouse / Grisette,regular
Dunham / Clos Saragnat Pourquoi Pas,Brasserie Dunham,Sour / Wild Beer - Flavored,special seasonal
Big Rig Midnight Kissed My Cow ,Big Rig Brewery,Stout - Milk / Sweet,regular
Half Pints Old Red Barn,Half Pints Brewing Co.,Sour Flemish Ale - Flanders Red / Oud Bruin,regular
Collective Arts IPA No.  6 ,Collective Arts Brewing,IPA - Flavored,special seasonal
Sawdust City Ol' Woody Alt,Sawdust City Brewing Co.,Altbier / Sticke Alt,regular
Okanagan Spring 1516 Lager,Okanagan Spring Brewery (Sleeman - Sapporo),Helles / Dortmunder Export,regular
Moody Russian Imperial Stout - Bourbon Barrel Aged,Moody Ales & Co,Stout - Imperial,special seasonal
Le Trou du Diable 12 Le Nombre Sublime,Le Trou du Diable (Six Pints - Molson Coors),Sour / Wild Beer,special seasonal
Pit Caribou Turlupine - Assemblée,Microbrasserie Pit Caribou,Stout - Imperial,regular
Four Winds Phaedra,Four Winds Brewing Co.,IPA - Rye,regular
Lion d'Or Stout Irlandaise,Lion d'Or / Golden Lion Pub & Brewery,Stout - Dry / Irish,regular
Dunham Double Cyclope (2017),Brasserie Dunham,IIPA DIPA - Imperial / Double IPA,regular
Pit Caribou Caribou Sure 3,Microbrasserie Pit Caribou,Sour / Wild Beer - Flavored,regular
Le Naufrageur Empress of Ireland,Microbrasserie Le Naufrageur,Porter,regular
Vox Populi Hop Orange,Microbrasserie Vox Populi (Groupe Glutenberg),IPA - Flavored,regular
Dieu du Ciel! 6e Soir (Pinot Noir),Brasserie Dieu du Ciel!,Pilsener - Imperial,special seasonal
Brouhaha Cuvée des  Saveurs ,Broue Pub Brouhaha (Coop MaBrasserie),Belgian Ale - Pale / Golden / Single,regular
Brasseurs Illimités Magouille ,Simple Malt - Brasseurs Illimités,Flavored - Other,autumn seasonal
Bellwoods Jelly King (Raspberry),Bellwoods Brewery,Sour / Wild Beer - Flavored,regular
Nickel Brook Duplicitous,Nickel Brook Brewing Co.,Gose,regular
Four Winds Nørwood ,Four Winds Brewing Co.,Saison / Farmhouse / Grisette,regular
Sawdust City Red Rocket Coffee Spiced Stout,Sawdust City Brewing Co.,Flavored - Other,autumn seasonal
Avant-Garde Octobre en Avril,Avant-Garde - Artisans Brasseurs (Avant-Garde),Barley Wine / Wheat Wine / Rye Wine,regular
Boxing Rock The Vicar's Cross Double IPA,Boxing Rock Brewing Company,IIPA DIPA - Imperial / Double IPA,regular
Les 2 Frères Charles Henri Ambrée ,Brasserie Les 2 Frères,Red Ale / International Amber Ale,regular
À La Fût Ma Première Blonde,À La Fût - Microbrasserie (Canada),Pilsener - Bohemian / Czech,regular
Collective Arts Surround Sound: Simcoe Galaxy & Columbus,Collective Arts Brewing,IIPA DIPA - Imperial / Double IPA,regular
Le Naufrageur À La Bourdages,Microbrasserie Le Naufrageur,Flavored - Fruit,special seasonal
RJ LochNess,Brasseurs RJ,Scottish Ale,regular
Beyond the Pale The Mullet,Beyond the Pale Brewing Company,IPA - Belgian / Saison,regular
Bomber Russian Doll,Bomber Brewing,Stout - Imperial,regular
Bellwoods Omerta ,Bellwoods Brewery,Pale Ale - American (APA),regular
Dunham Old Ale (Brandy),Brasserie Dunham,Old Ale,special seasonal
33 Acres of Life,33 Acres Brewing Co.,California Common / Steam Beer,regular
Brasseurs Illimités Saison Chaude,Simple Malt - Brasseurs Illimités,Saison / Farmhouse / Grisette,regular
La Chouape Saison des Battages,Brasserie La Chouape Brewing Co.,Saison / Farmhouse / Grisette,regular
Des Salamandres Poiré de Glace Édition Limitée,Domaine des Salamandres,Perry - Ice / Fortified,special seasonal
Dieu du Ciel! Noce de Soie,Brasserie Dieu du Ciel!,Saison / Farmhouse - Flavored,special seasonal
Highlander Blacksmith Smoked Porter,South River Brewing Co.,Porter - Smoked,regular
Pit Caribou Double IPA 2017,Microbrasserie Pit Caribou,IIPA DIPA - Imperial / Double IPA,regular
Nouvelle-France IPA de la Nouvelle-France,Microbrasserie Nouvelle-France,IPA - Hazy (NEIPA),regular
Whistler Black Tusk Ale,Whistler Brewing Co. (NorthAm Beverages),Mild Ale,regular
Charlevoix Vache Folle Summit Double IPA,Microbrasserie Charlevoix,IIPA DIPA - Imperial / Double IPA,special seasonal
Bas-Canada Connexion,Brasserie du Bas-Canada,Stout - Imperial Flavored / Pastry,regular
Le Castor Abricot,Microbrasserie Le Castor Brewing Co.,Sour / Wild Beer - Flavored,summer seasonal
Le Trou du Diable Nez de Poivrot,Le Trou du Diable (Six Pints - Molson Coors),Barley Wine / Wheat Wine / Rye Wine,regular
Le Castor Barleywine (Rhum),Microbrasserie Le Castor Brewing Co.,Barley Wine / Wheat Wine / Rye Wine,regular
Publican House Square Nail Pale Ale,Publican House Brewery,Pale Ale - American (APA),regular
Le Castor Pilsner,Microbrasserie Le Castor Brewing Co.,Pilsener - Bohemian / Czech,regular
Tree Mellow Moon,Tree Brewing Co. (Fireweed Brewing Corp),Flavored - Fruit,summer seasonal
Indie Alehouse Broken Hipster,Indie Alehouse Brewing Co.,Witbier / Belgian White Ale,regular
L'Espace Public Bière de Coin d'Rue,L'Espace Public - Brasseurs de Quartier,Sour / Wild Beer,regular
Archibald Belle Mer,Archibald - Microbrasserie (Labatt - AB InBev),IPA,regular
Bellwoods / Trillium Cutting Bells,Bellwoods Brewery,IIPA DIPA - Imperial / Double IPA,special seasonal
Beauregard Impériale Choco-Noisette (100% Bourbon),Beauregard - Brasserie Distillerie,Stout - Imperial Flavored / Pastry,regular
Messorem Go Ectoplasme Go,Messorem Bracitorium,IIPA DIPA - Imperial / Double Hazy (NEIPA),regular
Hopfenstark Saison Du Repos,Hopfenstark [Ho.st],Saison / Farmhouse / Grisette,regular
Central City Red Racer White Ale,Central City Brewers + Distillers,Witbier / Belgian White Ale,regular
RJ Robe Noire,Brasseurs RJ,Stout - Imperial,regular
Archibald Désirée,Archibald - Microbrasserie (Labatt - AB InBev),Blonde Ale / Golden Ale,regular
Ras L'Bock Solution,Ras L'Bock - Artisans Brasseurs,IPA,regular
Dunham Saison Fleurs Sauvages Été,Brasserie Dunham,Saison / Farmhouse - Flavored,regular
Le Bilboquet La Coup de Canon,Le Bilboquet - Microbrasserie / Brasserie Olten,Stout - Flavored / Pastry,regular
Twin Sails #Blessed Pale Ale,Twin Sails Brewing,Pale Ale - American (APA),special seasonal
Alley Kat Long Valley Scotch Ale,Alley Kat Brewing Company,Scotch Ale / Wee Heavy,special seasonal
Boréale Noirceur Impériale,Boréale - Brasseurs du Nord,Stout - Imperial Flavored / Pastry,series seasonal
Twin Sails Str8 Flexin',Twin Sails Brewing,Stout - Imperial,special seasonal
Vox Populi Kettle Sour Brunch,Microbrasserie Vox Populi (Groupe Glutenberg),Berliner Weisse - Flavored / Catharina Sour,summer seasonal
Mill Street Nightmare Pumpkin Ale,Mill Street Brewery (AB InBev),Flavored - Pumpkin / Vegetables,regular
Le Saint-Bock RIP,Le Saint-Bock Brasserie Artisanale,Porter - Imperial,special seasonal
Le Trèfle Noir O'Born Evil,Le Trèfle Noir - Brasserie Artisanale,Scotch Ale / Wee Heavy,regular
Great Lakes Brewery Burst!,Great Lakes Brewery (Canada),Pale Ale - Hazy / New England,regular
Dieu du Ciel! Pee Wee,Brasserie Dieu du Ciel!,ISA - Session IPA,regular
Boréale Antipode du Nord-Est,Boréale - Brasseurs du Nord,IPA,regular
Simple Malt Scotch Ale Réserve,Simple Malt - Brasseurs Illimités,Scotch Ale / Wee Heavy,regular
Kruhnen TPA Transylvanian Pale Ale,Brasserie Kruhnen,IPA,regular
Collective Arts IPA No. 16,Collective Arts Brewing,IPA - Flavored,regular
Brasserie Urbaine S.I.R. Popov,Brasserie Générale - Brasserie Urbaine [BG / BG18],Stout - Imperial,regular
Amsterdam Pale Rider,Amsterdam Brewery,Pale Lager - Hoppy / India (IPL),special seasonal
Blindman Longshadows IPA,Blindman Brewing,IPA,regular
Paddock Wood Bête Noire Oatmeal Stout,Paddock Wood Brewing Co.,Stout - Oatmeal,regular
Bellwoods Donkey Venom 2018+,Bellwoods Brewery,Sour / Wild Beer - Dark,series seasonal
Dunham Viti Vini Vici 1: Cuvée de Coussergues,Brasserie Dunham,Sour / Wild Beer - Flavored,special seasonal
Blindman Triphammer Robust Porter,Blindman Brewing,Porter,regular
Four Winds Featherweight,Four Winds Brewing Co.,ISA - Session IPA,regular
Le Trou du Diable La Bretteuse,Le Trou du Diable (Six Pints - Molson Coors),IPA,special seasonal
Beau's Tom Green Cherry Milk Stout,Beau's Brewing Co. / Halcyon Barrel House,Stout - Milk / Sweet,regular
Boombox Arcade Glow,Boombox Brewing Company,Pale Ale - Hazy / New England,regular
Dieu du Ciel! Saison Mile-End,Brasserie Dieu du Ciel!,Saison / Farmhouse / Grisette,regular
Superflux Easy Tiger,Superflux Beer Company,Pale Ale - American (APA),special seasonal
Shelton Stout Impérial,Bièrerie Shelton,Stout - Imperial,regular
Bas-Canada HYPA 10 X,Brasserie du Bas-Canada,IPA,regular
Charlevoix Session IPA,Microbrasserie Charlevoix,ISA - Session IPA,regular
Cowbell Doc Perdue's Bobcat,Cowbell Brewing Co.,Pale Ale - American (APA),regular
Farnham Scotch Ale,Farnham - Ale & Lager (Canada),Scotch Ale / Wee Heavy,regular
Le Trou du Diable Le Purgatoire - Archéoporter,Le Trou du Diable (Six Pints - Molson Coors),Sour / Wild Beer,special seasonal
All or Nothing Hopfenweisse,All Or Nothing Brewhouse,Wheat Ale - India / Hopfenweisse,regular
Dieu du Ciel! Wild Ultra,Brasserie Dieu du Ciel!,Sour / Wild Beer,regular
Simple Malt Vin d'Orge Réserve,Simple Malt - Brasseurs Illimités,Barley Wine / Wheat Wine / Rye Wine,regular
Glutenberg Blanche / White,Microbrasserie Glutenberg (Groupe Glutenberg),Witbier / Belgian White Ale,regular
Pit Caribou IIPA de la Sorcière V3,Microbrasserie Pit Caribou,IIPA DIPA - Imperial / Double IPA,regular
Helm Bernard,HELM - Microbrasserie sur Bernard,Pale Ale - American (APA),regular
Amsterdam Vicars Vice Olde Ale,Amsterdam Brewery,Old Ale,special seasonal
La Memphré Saaz Pils,Microbrasserie La Memphré,Pilsener - Bohemian / Czech,regular
Pit Caribou Stout à l'Avoine,Microbrasserie Pit Caribou,Stout - Oatmeal,regular
Phillips Krypton Rye PA,Phillips Brewing & Malting Co.,IPA - Rye,special seasonal
Flying Monkeys The Mutants are Revolting,Flying Monkeys Craft Brewery,ISA - Session IPA,regular
MaBrasserie Tribale Manitou (Whisky),MaBrasserie - Coopérative Brassicole,Stout - Imperial,regular
Brouhaha Sergent Ripin,Broue Pub Brouhaha (Coop MaBrasserie),Saison / Farmhouse / Grisette,regular
Dunham Stout Impériale Russe - Vanille et Café (Bourbon),Brasserie Dunham,Stout - Imperial Flavored / Pastry,special seasonal
Le Bilboquet La Nelligan,Le Bilboquet - Microbrasserie / Brasserie Olten,Weissbier - Dunkelweizen,regular
Trailway Ooz,Trailway Brewing Company,IIPA DIPA - Imperial / Double IPA,regular
Dieu du Ciel! Solstice d'Été aux Prunes,Brasserie Dieu du Ciel!,Berliner Weisse - Flavored / Catharina Sour,regular
